[
  {
    "file": {
      "sha256": "",
      "url": "https://raw.githubusercontent.com/GfSE/CASCaDE-Ontology/1a49ef36ec077b23f1d6caaf4a50b541a3a3e696/AAS/ElectricalElectronicalDesign.aasx"
    },
    "id": "sha256-0000000000000000000000000000000000000000000000000000000000000000",
    "metadata": {},
    "provenance": {
      "discovered_at": "2026-04-19T04:06:47.491918+00:00",
      "license": null,
      "source_ref": "GfSE/CASCaDE-Ontology",
      "source_type": "github"
    },
    "verification": {
      "status": "failed",
      "summary": "Download failed: Suspicious archive: Invalid ZIP file: File is not a zip file"
    }
  },
  {
    "file": {
      "filename": "09_SchneiderElectric.aasx",
      "sha256": "11aba40eb0544cc0e4f4346fe1f091f555a0698304322518a0e23ddc0e47e42d",
      "size_bytes": 17375557,
      "url": "https://admin-shell-io.com/samples/aasx/09_SchneiderElectric.aasx"
    },
    "id": "sha256-11aba40eb0544cc0e4f4346fe1f091f555a0698304322518a0e23ddc0e47e42d",
    "metadata": {},
    "provenance": {
      "discovered_at": "2026-02-01T15:26:11.474515+00:00",
      "last_verified_at": "2026-02-01T15:26:11.474515+00:00",
      "license": null,
      "source_ref": "https://admin-shell-io.com/samples/",
      "source_type": "seed"
    },
    "verification": {
      "engine": "aas-test-engines/<function version at 0x1072eca40>",
      "exit_code": 1,
      "report_path": "data/reports/11aba40eb0544cc0e4f4346fe1f091f555a0698304322518a0e23ddc0e47e42d.json",
      "status": "parseable",
      "summary": "File parseable but 0 compliance check(s) failed"
    }
  },
  {
    "file": {
      "filename": "05_Bosch.aasx",
      "sha256": "243ea573f7994cdb3dea61930c254fd1818a8449d2d9f85fd0b014f2b0b6a38b",
      "size_bytes": 32950911,
      "url": "https://admin-shell-io.com/samples/aasx/05_Bosch.aasx"
    },
    "id": "sha256-243ea573f7994cdb3dea61930c254fd1818a8449d2d9f85fd0b014f2b0b6a38b",
    "metadata": {},
    "provenance": {
      "discovered_at": "2026-02-01T15:25:59.839722+00:00",
      "last_verified_at": "2026-02-01T15:25:59.839722+00:00",
      "license": null,
      "source_ref": "https://admin-shell-io.com/samples/",
      "source_type": "seed"
    },
    "verification": {
      "engine": "aas-test-engines/<function version at 0x1072eca40>",
      "exit_code": 1,
      "report_path": "data/reports/243ea573f7994cdb3dea61930c254fd1818a8449d2d9f85fd0b014f2b0b6a38b.json",
      "status": "parseable",
      "summary": "File parseable but 0 compliance check(s) failed"
    }
  },
  {
    "file": {
      "filename": "34_Festo.aasx",
      "sha256": "2767b4e9c80bbaf451d68911dabae9dc20a9e9f14c17567ef5afeac05b2fe392",
      "size_bytes": 5327502,
      "url": "https://admin-shell-io.com/samples/aasx/34_Festo.aasx"
    },
    "id": "sha256-2767b4e9c80bbaf451d68911dabae9dc20a9e9f14c17567ef5afeac05b2fe392",
    "metadata": {},
    "provenance": {
      "discovered_at": "2026-02-01T15:26:43.594206+00:00",
      "last_verified_at": "2026-02-01T15:26:43.594206+00:00",
      "license": null,
      "source_ref": "https://admin-shell-io.com/samples/",
      "source_type": "seed"
    },
    "verification": {
      "engine": "aas-test-engines/<function version at 0x1072eca40>",
      "exit_code": 1,
      "report_path": "data/reports/2767b4e9c80bbaf451d68911dabae9dc20a9e9f14c17567ef5afeac05b2fe392.json",
      "status": "parseable",
      "summary": "File parseable but 0 compliance check(s) failed"
    }
  },
  {
    "file": {
      "filename": "33_SICK.aasx",
      "sha256": "293419ad533a55694bcbfc5ee630aa9ea0b852e4b3ddb26c8d510afe26467b58",
      "size_bytes": 234390,
      "url": "https://admin-shell-io.com/samples/aasx/33_SICK.aasx"
    },
    "id": "sha256-293419ad533a55694bcbfc5ee630aa9ea0b852e4b3ddb26c8d510afe26467b58",
    "metadata": {},
    "provenance": {
      "discovered_at": "2026-02-01T15:26:42.617412+00:00",
      "last_verified_at": "2026-02-01T15:26:42.617412+00:00",
      "license": null,
      "source_ref": "https://admin-shell-io.com/samples/",
      "source_type": "seed"
    },
    "verification": {
      "engine": "aas-test-engines/<function version at 0x1072eca40>",
      "exit_code": 1,
      "report_path": "data/reports/293419ad533a55694bcbfc5ee630aa9ea0b852e4b3ddb26c8d510afe26467b58.json",
      "status": "parseable",
      "summary": "File parseable but 0 compliance check(s) failed"
    }
  },
  {
    "file": {
      "filename": "15_Siemens.aasx",
      "sha256": "3c782bd589aac4d4ea7b9db74c6a22570ed3612611c051eab88b5c94cd3c7a57",
      "size_bytes": 14033241,
      "url": "https://admin-shell-io.com/samples/aasx/15_Siemens.aasx"
    },
    "id": "sha256-3c782bd589aac4d4ea7b9db74c6a22570ed3612611c051eab88b5c94cd3c7a57",
    "metadata": {},
    "provenance": {
      "discovered_at": "2026-02-01T15:26:19.833208+00:00",
      "last_verified_at": "2026-02-01T15:26:19.833208+00:00",
      "license": null,
      "source_ref": "https://admin-shell-io.com/samples/",
      "source_type": "seed"
    },
    "verification": {
      "engine": "aas-test-engines/<function version at 0x1072eca40>",
      "exit_code": 1,
      "report_path": "data/reports/3c782bd589aac4d4ea7b9db74c6a22570ed3612611c051eab88b5c94cd3c7a57.json",
      "status": "parseable",
      "summary": "File parseable but 0 compliance check(s) failed"
    }
  },
  {
    "file": {
      "filename": "23_Festo.aasx",
      "sha256": "3ff6fe6e64bd3360dafbad33391228d0140e81b04a0ec3531b399d65bf529f4f",
      "size_bytes": 2207689,
      "url": "https://admin-shell-io.com/samples/aasx/23_Festo.aasx"
    },
    "id": "sha256-3ff6fe6e64bd3360dafbad33391228d0140e81b04a0ec3531b399d65bf529f4f",
    "metadata": {},
    "provenance": {
      "discovered_at": "2026-02-01T15:26:34.062696+00:00",
      "last_verified_at": "2026-02-01T15:26:34.062696+00:00",
      "license": null,
      "source_ref": "https://admin-shell-io.com/samples/",
      "source_type": "seed"
    },
    "verification": {
      "engine": "aas-test-engines/<function version at 0x1072eca40>",
      "exit_code": 1,
      "report_path": "data/reports/3ff6fe6e64bd3360dafbad33391228d0140e81b04a0ec3531b399d65bf529f4f.json",
      "status": "parseable",
      "summary": "File parseable but 0 compliance check(s) failed"
    }
  },
  {
    "file": {
      "filename": "21_Festo.aasx",
      "sha256": "4d626c0b00a720bd54a0355e1d61eeabc32abb1c076e5eea90cef95d3f5860e1",
      "size_bytes": 2245717,
      "url": "https://admin-shell-io.com/samples/aasx/21_Festo.aasx"
    },
    "id": "sha256-4d626c0b00a720bd54a0355e1d61eeabc32abb1c076e5eea90cef95d3f5860e1",
    "metadata": {},
    "provenance": {
      "discovered_at": "2026-02-01T15:26:32.477541+00:00",
      "last_verified_at": "2026-02-01T15:26:32.477541+00:00",
      "license": null,
      "source_ref": "https://admin-shell-io.com/samples/",
      "source_type": "seed"
    },
    "verification": {
      "engine": "aas-test-engines/<function version at 0x1072eca40>",
      "exit_code": 1,
      "report_path": "data/reports/4d626c0b00a720bd54a0355e1d61eeabc32abb1c076e5eea90cef95d3f5860e1.json",
      "status": "parseable",
      "summary": "File parseable but 0 compliance check(s) failed"
    }
  },
  {
    "file": {
      "filename": "26_Festo.aasx",
      "sha256": "4de3d19e6db2b1a210bc472b7448988341798375fca17dfc18c44679596f4258",
      "size_bytes": 3500596,
      "url": "https://admin-shell-io.com/samples/aasx/26_Festo.aasx"
    },
    "id": "sha256-4de3d19e6db2b1a210bc472b7448988341798375fca17dfc18c44679596f4258",
    "metadata": {},
    "provenance": {
      "discovered_at": "2026-02-01T15:26:36.301145+00:00",
      "last_verified_at": "2026-02-01T15:26:36.301145+00:00",
      "license": null,
      "source_ref": "https://admin-shell-io.com/samples/",
      "source_type": "seed"
    },
    "verification": {
      "engine": "aas-test-engines/<function version at 0x1072eca40>",
      "exit_code": 1,
      "report_path": "data/reports/4de3d19e6db2b1a210bc472b7448988341798375fca17dfc18c44679596f4258.json",
      "status": "parseable",
      "summary": "File parseable but 0 compliance check(s) failed"
    }
  },
  {
    "file": {
      "filename": "06_Bosch.aasx",
      "sha256": "5005e229a83722c1a8c4468b0f0d790e45431ee5f340a11b37a63060ec9bfcd8",
      "size_bytes": 17668433,
      "url": "https://admin-shell-io.com/samples/aasx/06_Bosch.aasx"
    },
    "id": "sha256-5005e229a83722c1a8c4468b0f0d790e45431ee5f340a11b37a63060ec9bfcd8",
    "metadata": {},
    "provenance": {
      "discovered_at": "2026-02-01T15:26:06.058965+00:00",
      "last_verified_at": "2026-02-01T15:26:06.058965+00:00",
      "license": null,
      "source_ref": "https://admin-shell-io.com/samples/",
      "source_type": "seed"
    },
    "verification": {
      "engine": "aas-test-engines/<function version at 0x1072eca40>",
      "exit_code": 1,
      "report_path": "data/reports/5005e229a83722c1a8c4468b0f0d790e45431ee5f340a11b37a63060ec9bfcd8.json",
      "status": "parseable",
      "summary": "File parseable but 0 compliance check(s) failed"
    }
  },
  {
    "file": {
      "filename": "13_DKE.aasx",
      "sha256": "54cffdfa3072d3cc68d04eddbdce639f8b5b17a6b104e3b60cfc14641d98cfc1",
      "size_bytes": 403620,
      "url": "https://admin-shell-io.com/samples/aasx/13_DKE.aasx"
    },
    "id": "sha256-54cffdfa3072d3cc68d04eddbdce639f8b5b17a6b104e3b60cfc14641d98cfc1",
    "metadata": {},
    "provenance": {
      "discovered_at": "2026-02-01T15:26:15.189850+00:00",
      "last_verified_at": "2026-02-01T15:26:15.189850+00:00",
      "license": null,
      "source_ref": "https://admin-shell-io.com/samples/",
      "source_type": "seed"
    },
    "verification": {
      "engine": "aas-test-engines/<function version at 0x1072eca40>",
      "exit_code": 1,
      "report_path": "data/reports/54cffdfa3072d3cc68d04eddbdce639f8b5b17a6b104e3b60cfc14641d98cfc1.json",
      "status": "parseable",
      "summary": "File parseable but 0 compliance check(s) failed"
    }
  },
  {